{
  "$schema": "https://json-schema.org/draft/2020-12/schema",
  "$id": "https://ghassenelkamel.github.io/portfolio-content/schemas/skills.schema.json",
  "type": "object",
  "additionalProperties": false,
  "required": ["schemaVersion", "updatedAt", "eyebrow", "title", "description", "items"],
  "properties": {
    "schemaVersion": { "const": 1 },
    "updatedAt": {
      "type": "string",
      "pattern": "^\\d{4}-\\d{2}-\\d{2}T\\d{2}:\\d{2}:\\d{2}Z$"
    },
    "eyebrow": { "type": "string", "minLength": 1 },
    "title": { "type": "string", "minLength": 1 },
    "description": { "type": "string", "minLength": 1 },
    "items": {
      "type": "array",
      "minItems": 1,
      "items": {
        "type": "object",
        "additionalProperties": false,
        "required": ["id", "name", "level", "order"],
        "properties": {
          "id": { "type": "string", "minLength": 1 },
          "name": { "type": "string", "minLength": 1 },
          "level": { "type": "integer", "minimum": 0, "maximum": 100 },
          "order": { "type": "integer", "minimum": 0 }
        }
      }
    }
  }
}
